{
  "id": "RADAR-2025-0005",
  "category": "platform-vuln",
  "title": "figma-developer-mcp passes tool input into a shell command",
  "summary": "The Framelink figma-developer-mcp server built a curl command string with unsanitised input inside fetchWithRetry and ran it through child_process.exec, so shell metacharacters in a get_figma_data request executed as commands. Versions up to and including 0.6.2 are affected; 0.6.3 fixes it.",
  "indicators": [
    {
      "type": "package",
      "registry": "npm",
      "name": "figma-developer-mcp",
      "version": "<=0.6.2",
      "affected": {
        "ranges": [
          {
            "last_affected": "0.6.2"
          }
        ]
      }
    },
    {
      "type": "mcp-server",
      "name": "figma-developer-mcp",
      "repo": "https://github.com/GLips/Figma-Context-MCP"
    }
  ],
  "severity": "high",
  "severity_rationale": "Command execution in the MCP server process, reachable by any content the agent is asked to fetch through the tool.",
  "status": "remediated",
  "first_seen": "2025-09-29",
  "last_updated": "2026-08-25",
  "sources": [
    {
      "url": "https://github.com/GLips/Figma-Context-MCP/security/advisories/GHSA-gxw4-4fc5-9gr5",
      "publisher": "Framelink (maintainer advisory)",
      "type": "primary"
    },
    {
      "url": "https://github.com/advisories/GHSA-gxw4-4fc5-9gr5",
      "publisher": "GitHub Advisory Database",
      "type": "primary"
    }
  ],
  "affected_tools": [
    "cursor",
    "claude-code",
    "generic-mcp"
  ],
  "related": [
    "CVE-2025-53967",
    "GHSA-gxw4-4fc5-9gr5"
  ]
}
