{
  "id": "RADAR-2025-0019",
  "category": "platform-vuln",
  "title": "InversePrompt: Claude Code path and command checks bypassed",
  "summary": "Claude Code validated file paths by string prefix rather than canonical path, letting a sibling directory sharing the working directory's prefix be read, and a command-parsing error let an untrusted command run without the confirmation prompt. Cymulate reported both; the path issue was fixed in 0.2.111 and the command injection in 1.0.20.",
  "indicators": [
    {
      "type": "package",
      "registry": "npm",
      "name": "@anthropic-ai/claude-code",
      "version": "<1.0.20",
      "affected": {
        "ranges": [
          {
            "fixed": "1.0.20"
          }
        ]
      }
    }
  ],
  "severity": "high",
  "severity_rationale": "Bypasses the two controls that bound an agent's reach, the directory sandbox and the run-command prompt, using content the agent is asked to read.",
  "status": "remediated",
  "first_seen": "2025-08-05",
  "last_updated": "2026-08-25",
  "sources": [
    {
      "url": "https://cymulate.com/blog/cve-2025-547954-54795-claude-inverseprompt/",
      "publisher": "Cymulate Research Labs",
      "type": "primary"
    },
    {
      "url": "https://nvd.nist.gov/vuln/detail/CVE-2025-54795",
      "publisher": "NVD",
      "type": "secondary"
    }
  ],
  "affected_tools": [
    "claude-code"
  ],
  "related": [
    "CVE-2025-54794",
    "CVE-2025-54795"
  ]
}
